,id,title,context,question,answers
112,572c0bcb750c471900ed4c90,God,"Prayer plays a significant role among many believers. Muslims believe that the purpose of existence is to worship God. He is viewed as a personal God and there are no intermediaries, such as clergy, to contact God. Prayer often also includes supplication and asking forgiveness. God is often believed to be forgiving. For example, a hadith states God would replace a sinless people with one who sinned but still asked repentance. Christian theologian Alister McGrath writes that there are good reasons to suggest that a ""personal god"" is integral to the Christian outlook, but that one has to understand it is an analogy. ""To say that God is like a person is to affirm the divine ability and willingness to relate to others. This does not imply that God is human, or located at a specific point in the universe.""",What is a muslims life purpose?,"{'text': ['to worship God'], 'answer_start': [103]}"
113,5acf9ec577cf76001a685596,Prime_minister,"As well as being head of government, a prime minister may have other roles or titles—the Prime Minister of the United Kingdom, for example, is also First Lord of the Treasury and Minister for the Civil Service. Prime ministers may take other ministerial posts—for example, during the Second World War, Winston Churchill was also Minister of Defence (although there was then no Ministry of Defence), and in the current cabinet of Israel, Benjamin Netanyahu also serves as Minister of Communications, Foreign Affairs, Regional Cooperation, Economy and Interior",What are former titles once held by the Prime Minister of the UK?,"{'text': [], 'answer_start': []}"
114,5728c9553acd2414000dfe79,Detroit,"Berry Gordy, Jr. founded Motown Records which rose to prominence during the 1960s and early 1970s with acts such as Stevie Wonder, The Temptations, The Four Tops, Smokey Robinson & The Miracles, Diana Ross & The Supremes, the Jackson 5, Martha and the Vandellas, The Spinners, Gladys Knight & the Pips, The Marvelettes, The Elgins, The Monitors, The Velvelettes and Marvin Gaye. Artists were backed by in-house vocalists The Andantes and The Funk Brothers, the Motown house band that was featured in Paul Justman's 2002 documentary film Standing in the Shadows of Motown, based on Allan Slutsky's book of the same name.",Who founded Motown records?,"{'text': ['Berry Gordy, Jr.'], 'answer_start': [0]}"
115,5acfbc3a77cf76001a685b3f,Zhejiang,"Greenware ceramics made from celadon had been made in the area since the 3rd-century Jin dynasty, but it returned to prominence—particularly in Longquan—during the Southern Song and Yuan. Longquan greenware is characterized by a thick unctuous glaze of a particular bluish-green tint over an otherwise undecorated light-grey porcellaneous body that is delicately potted. Yuan Longquan celadons feature a thinner, greener glaze on increasingly large vessels with decoration and shapes derived from Middle Eastern ceramic and metalwares. These were produced in large quantities for the Chinese export trade to Southeast Asia, the Middle East, and (during the Ming) Europe. By the Ming, however, production was notably deficient in quality. It is in this period that the Longquan kilns declined, to be eventually replaced in popularity and ceramic production by the kilns of Jingdezhen in Jiangxi.",What were redware ceramics made from?,"{'text': [], 'answer_start': []}"
116,56fa2ab88f12f319006300e8,Wood,"In ring-porous woods each season's growth is always well defined, because the large pores formed early in the season abut on the denser tissue of the year before.",What size pores form early in ring-porous woods' growing season?,"{'text': ['large'], 'answer_start': [78]}"
117,5a55621f134fea001a0e1a74,Computer_security,"One use of the term ""computer security"" refers to technology that is used to implement secure operating systems. In the 1980s the United States Department of Defense (DoD) used the ""Orange Book"" standards, but the current international standard ISO/IEC 15408, ""Common Criteria"" defines a number of progressively more stringent Evaluation Assurance Levels. Many common operating systems meet the EAL4 standard of being ""Methodically Designed, Tested and Reviewed"", but the formal verification required for the highest levels means that they are uncommon. An example of an EAL6 (""Semiformally Verified Design and Tested"") system is Integrity-178B, which is used in the Airbus A380 and several military jets.",Which level do many common operating systems meet?,"{'text': [], 'answer_start': []}"
118,5a63f3017f3c80001a150bb7,Germans,"Pan-Germanism's origins began in the early 19th century following the Napoleonic Wars. The wars launched a new movement that was born in France itself during the French Revolution. Nationalism during the 19th century threatened the old aristocratic regimes. Many ethnic groups of Central and Eastern Europe had been divided for centuries, ruled over by the old Monarchies of the Romanovs and the Habsburgs. Germans, for the most part, had been a loose and disunited people since the Reformation when the Holy Roman Empire was shattered into a patchwork of states. The new German nationalists, mostly young reformers such as Johann Tillmann of East Prussia, sought to unite all the German-speaking and ethnic-German (Volksdeutsche) people.",What people had been united since the Reformation?,"{'text': [], 'answer_start': []}"
119,56d12c3d17492d1400aabb4c,Kanye_West,"On November 10, 2007, at approximately 7:35 pm, paramedics responding to an emergency call transported West's mother, Donda West, to the nearby Centinela Freeman Hospital in Marina del Rey, California. She was unresponsive in the emergency room, and after resuscitation attempts, doctors pronounced her dead at approximately 8:30 pm, at age 58. The Los Angeles County coroner's office said in January 2008 that West had died of heart disease while suffering ""multiple post-operative factors"" after plastic surgery. She had undergone liposuction and breast reduction. Beverly Hills plastic surgeon Andre Aboolian had refused to do the surgery because West had a health condition that placed her at risk for a heart attack. Aboolian referred her to an internist to investigate her cardiac issue. She never met with the doctor recommended by Aboolian and had the procedures performed by a third doctor, Jan Adams.","At approximately what time did paramedics receive the call about Kanye West's mother, Donda?","{'text': ['7:35 pm'], 'answer_start': [39]}"
120,57293c2eaf94a219006aa1d4,"United_States_presidential_election,_2004","On July 6, John Kerry selected John Edwards as his running mate, shortly before the 2004 Democratic National Convention in Boston, held later that month. Days before Kerry announced Edwards as his running mate, Kerry gave a short list of three candidates: Sen John Edwards, Rep Dick Gephardt, and Gov Tom Vilsack. Heading into the convention, the Kerry/Edwards ticket unveiled their new slogan—a promise to make America ""stronger at home and more respected in the world."" Kerry made his Vietnam War experience the prominent theme of the convention. In accepting the nomination, he began his speech with, ""I'm John Kerry and I'm reporting for duty."" He later delivered what may have been the speech's most memorable line when he said, ""the future doesn't belong to fear, it belongs to freedom"", a quote that later appeared in a Kerry/Edwards television advertisement.",How many candidates did John Kerry name as potential prospects to be his running mate?,"{'text': ['three'], 'answer_start': [238]}"
121,56cc27346d243a140015eebb,Sino-Tibetan_relations_during_the_Ming_dynasty,"Some scholars note that Tibetan leaders during the Ming frequently engaged in civil war and conducted their own foreign diplomacy with neighboring states such as Nepal. Some scholars underscore the commercial aspect of the Ming-Tibetan relationship, noting the Ming dynasty's shortage of horses for warfare and thus the importance of the horse trade with Tibet. Others argue that the significant religious nature of the relationship of the Ming court with Tibetan lamas is underrepresented in modern scholarship. In hopes of reviving the unique relationship of the earlier Mongol leader Kublai Khan (r. 1260–1294) and his spiritual superior Drogön Chögyal Phagpa (1235–1280) of the Sakya school of Tibetan Buddhism, the Yongle Emperor (r. 1402–1424) made a concerted effort to build a secular and religious alliance with Deshin Shekpa (1384–1415), the Karmapa of the Karma Kagyu school. However, the Yongle Emperor's attempts were unsuccessful.",During what years did the Mongol leader Kublai Khan rule?,"{'text': ['1402–1424'], 'answer_start': [739]}"
122,56e8f74999e8941900975f40,Westminster_Abbey,"In addition there are two service bells, cast by Robert Mot, in 1585 and 1598 respectively, a Sanctus bell cast in 1738 by Richard Phelps and Thomas Lester and two unused bells—one cast about 1320, by the successor to R de Wymbish, and a second cast in 1742, by Thomas Lester. The two service bells and the 1320 bell, along with a fourth small silver ""dish bell"", kept in the refectory, have been noted as being of historical importance by the Church Buildings Council of the Church of England.",Who cast the Sanctus bell?,"{'text': ['Richard Phelps and Thomas Lester'], 'answer_start': [123]}"
123,57295be46aef051400154d6a,"New_Haven,_Connecticut","Since approximately 2000, many parts of downtown New Haven have been revitalized, with new restaurants, nightlife, and small retail stores. In particular, the area surrounding the New Haven Green has experienced an influx of apartments and condominiums. In recent years, downtown retail options have increased with the opening of new stores such as Urban Oufitters, J Crew, Origins, American Apparel, Gant Clothing, and an Apple Store, joining older stores such as Barnes & Noble, Cutlers Records, and Raggs Clothing. In addition, downtown's growing residential population will be served by two new supermarkets, a Stop & Shop just outside downtown and Elm City Market located one block from the Green. The recent turnaround of downtown New Haven has received positive press from various periodicals.",What has happen in New Haven Green during the 2000s?,"{'text': ['experienced an influx of apartments'], 'answer_start': [200]}"
124,57294fd36aef051400154ca8,"New_Haven,_Connecticut","The American Civil War boosted the local economy with wartime purchases of industrial goods, including that of the New Haven Arms Company, which would later become the Winchester Repeating Arms Company. (Winchester would continue to produce arms in New Haven until 2006, and many of the buildings that were a part of the Winchester plant are now a part of the Winchester Repeating Arms Company Historic District.) After the war, population grew and doubled by the start of the 20th century, most notably due to the influx of immigrants from southern Europe, particularly Italy. Today, roughly half the populations of East Haven, West Haven, and North Haven are Italian-American. Jewish immigration to New Haven has left an enduring mark on the city. Westville was the center of Jewish life in New Haven, though today many have fanned out to suburban communities such as Woodbridge and Cheshire.","The Civil War had many effects after the war, what was the main effect for New Haven?","{'text': ['population grew and doubled'], 'answer_start': [429]}"
125,5ace620d32bba1001ae4a4e3,Appalachian_Mountains,"By 1755, the obstacle to westward expansion had been thus reduced by half; outposts of the English colonists had penetrated the Allegheny and Cumberland plateaus, threatening French monopoly in the transmontane region, and a conflict became inevitable. Making common cause against the French to determine the control of the Ohio valley, the unsuspected strength of the colonists was revealed, and the successful ending of the French and Indian War extended England's territory to the Mississippi. To this strength the geographic isolation enforced by the Appalachian mountains had been a prime contributor. The confinement of the colonies between an ocean and a mountain wall led to the fullest occupation of the coastal border of the continent, which was possible under existing conditions of agriculture, conducting to a community of purpose, a political and commercial solidarity, which would not otherwise have been developed. As early as 1700 it was possible to ride from Portland, Maine, to southern Virginia, sleeping each night at some considerable village. In contrast to this complete industrial occupation, the French territory was held by a small and very scattered population, its extent and openness adding materially to the difficulties of a disputed tenure. Bearing the brunt of this contest as they did, the colonies were undergoing preparation for the subsequent struggle with the home government. Unsupported by shipping, the American armies fought toward the sea with the mountains at their back protecting them against British leagued with the Native Americans. The few settlements beyond the Great Valley were free for self-defense, debarred from general participation in the conflict by reason of their position.",Who did the English ally with in the war?,"{'text': [], 'answer_start': []}"
126,5ad352da604f3c001a3fdd27,Elizabeth_II,"Elizabeth was born in London to the Duke and Duchess of York, later King George VI and Queen Elizabeth, and was the elder of their two daughters. She was educated privately at home. Her father acceded to the throne on the abdication of his brother Edward VIII in 1936, from which time she was the heir presumptive. She began to undertake public duties during World War II, serving in the Auxiliary Territorial Service. In 1947, she married Philip, Duke of Edinburgh, with whom she has four children: Charles, Anne, Andrew, and Edward.",Who is Elizabeth's oldest child?,"{'text': [], 'answer_start': []}"
127,572695e8dd62a815002e8a62,Napoleon,"The Allied disaster at Austerlitz significantly shook the faith of Emperor Francis in the British-led war effort. France and Austria agreed to an armistice immediately and the Treaty of Pressburg followed shortly after on 26 December. Pressburg took Austria out of both the war and the Coalition while reinforcing the earlier treaties of Campo Formio and of Lunéville between the two powers. The treaty confirmed the Austrian loss of lands to France in Italy and Bavaria, and lands in Germany to Napoleon's German allies. It also imposed an indemnity of 40 million francs on the defeated Habsburgs and allowed the fleeing Russian troops free passage through hostile territories and back to their home soil. Napoleon went on to say, ""The battle of Austerlitz is the finest of all I have fought."" Frank McLynn suggests that Napoleon was so successful at Austerlitz that he lost touch with reality, and what used to be French foreign policy became a ""personal Napoleonic one"". Vincent Cronin disagrees, stating that Napoleon was not overly ambitious for himself, ""he embodied the ambitions of thirty million Frenchmen"".",The Allied defeat at what location caused Emperor Francis to doubt the chances of the war effort?,"{'text': ['Austerlitz'], 'answer_start': [23]}"
128,572fdfbda23a5019007fcab2,Bacteria,"Some species of bacteria kill and then consume other microorganisms, these species are called predatory bacteria. These include organisms such as Myxococcus xanthus, which forms swarms of cells that kill and digest any bacteria they encounter. Other bacterial predators either attach to their prey in order to digest them and absorb nutrients, such as Vampirovibrio chlorellavorus, or invade another cell and multiply inside the cytosol, such as Daptobacter. These predatory bacteria are thought to have evolved from saprophages that consumed dead microorganisms, through adaptations that allowed them to entrap and kill other organisms.",Which way do Vampirovibrio absorb nutrients of other microorganisms?,"{'text': ['attach to their prey in order to digest them'], 'answer_start': [277]}"
129,570aa4a44103511400d598b6,Houston,"The second-largest commercial airport is William P. Hobby Airport (named Houston International Airport until 1967) which operates primarily short- to medium-haul domestic flights. However, in 2015 Southwest Airlines launched service from a new international terminal at Hobby airport to several destinations in Mexico, Central America, and the Caribbean. These were the first international flights flown from Hobby since 1969. Houston's aviation history is showcased in the 1940 Air Terminal Museum located in the old terminal building on the west side of the airport. Hobby Airport has been recognized with two awards for being one of the top five performing airports in the world and for customer service by Airports Council International.",What is the second airport that serves Houston?,"{'text': ['William P. Hobby Airport'], 'answer_start': [41]}"
130,5728d0114b864d1900164ea3,Estonia,"The Estonian Cultural Autonomy law that was passed in 1925 was unique in Europe at that time. Cultural autonomies could be granted to minorities numbering more than 3,000 people with longstanding ties to the Republic of Estonia. Before the Soviet occupation, the Germans and Jewish minorities managed to elect a cultural council. The Law on Cultural Autonomy for National Minorities was reinstated in 1993. Historically, large parts of Estonia's northwestern coast and islands have been populated by indigenous ethnically Rannarootslased (Coastal Swedes).","In 1925, what rule did Estonia create that was unique in Europe?","{'text': ['The Estonian Cultural Autonomy law'], 'answer_start': [0]}"
131,5ad2782bd7d075001a429558,Dialect,"During the Risorgimento, proponents of Italian republicanism and Italian nationalism, such as Alessandro Manzoni, stressed the importance of establishing a uniform national language in order to better create an Italian national identity. With the unification of Italy in the 1860s, standard Italian became the official national language of the new Italian state, while the various unofficial regional languages of Italy gradually became regarded as subordinate ""dialects"" to Italian, increasingly associated negatively with lack of education or provincialism. However, at the time of the Italian Unification, standard Italian still existed mainly as a literary language, and only 2.5% of Italy's population could speak standard Italian.",During what period were proponents of Italian Unification stressing the importance of establishing a uniform national language?,"{'text': [], 'answer_start': []}"
132,571080dbb654c5140001f931,Age_of_Enlightenment,"The strongest contribution of the French Academies to the public sphere comes from the concours académiques (roughly translated as 'academic contests') they sponsored throughout France. These academic contests were perhaps the most public of any institution during the Enlightenment. The practice of contests dated back to the Middle Ages, and was revived in the mid-17th century. The subject matter had previously been generally religious and/or monarchical, featuring essays, poetry, and painting. By roughly 1725, however, this subject matter had radically expanded and diversified, including ""royal propaganda, philosophical battles, and critical ruminations on the social and political institutions of the Old Regime."" Topics of public controversy were also discussed such as the theories of Newton and Descartes, the slave trade, women's education, and justice in France.",Which topics of public controversy became more widely discussed around 1725?,"{'text': [""theories of Newton and Descartes, the slave trade, women's education, and justice""], 'answer_start': [785]}"
133,5a551e9d134fea001a0e1959,Communications_in_Somalia,"In November 2013, Somalia received its first fiber optic connection. The country previously had to rely on expensive satellite links due to the civil conflict, which limited internet usage. However, residents now have access to broadband internet cable for the first time after an agreement reached between Hormuud Telecom and Liquid Telecom. The deal will see Liquid Telecom link Hormuud to its 17,000 km (10,500 mile) network of terrestrial cables, which will deliver faster internet capacity. The fiber optic connection will also make online access more affordable to the average user. This in turn is expected to further increase the number of internet users. Dalkom Somalia reached a similar agreement with the West Indian Ocean Cable Company (WIOCC) Ltd, which it holds shares in. Effective the first quarter of 2014, the deal will establish fiber optic connectivity to and from Somalia via the EASSy cable. The new services are expected to reduce the cost of international bandwidth and to better optimize performance, thereby further broadening internet access. Dalkom Somalia is concurrently constructing a 1,000 square mile state-of-the-art data center in Mogadishu. The site will facilitate direct connection into the international fiber optic network by hosting equipment for all of the capital's ISPs and telecommunication companies.",How long is Hormuud's cable network?,"{'text': [], 'answer_start': []}"
134,572aed7d34ae481900dead28,Empiricism,"Philosophical empiricists hold no knowledge to be properly inferred or deduced unless it is derived from one's sense-based experience. This view is commonly contrasted with rationalism, which states that knowledge may be derived from reason independently of the senses. For example, John Locke held that some knowledge (e.g. knowledge of God's existence) could be arrived at through intuition and reasoning alone. Similarly Robert Boyle, a prominent advocate of the experimental method, held that we have innate ideas. The main continental rationalists (Descartes, Spinoza, and Leibniz) were also advocates of the empirical ""scientific method"".",Where does rationalism say knowledge comes from?,"{'text': ['reason independently of the senses'], 'answer_start': [234]}"
135,572640d4271a42140099d7d3,Incandescent_light_bulb,"The halogen lamp reduces uneven evaporation of the filament and eliminates darkening of the envelope by filling the lamp with a halogen gas at low pressure, rather than an inert gas. The halogen cycle increases the lifetime of the bulb and prevents its darkening by redepositing tungsten from the inside of the bulb back onto the filament. The halogen lamp can operate its filament at a higher temperature than a standard gas filled lamp of similar power without loss of operating life. Such bulbs are much smaller than normal incandescent bulbs, and are widely used where intense illumination is needed in a limited space. Fiber-optic lamps for optical microscopy is one typical application.","Does the halogen bulp increase, reduce, or have no effect on filament evaporation?","{'text': ['reduces'], 'answer_start': [17]}"
136,57300eee947a6a140053d012,Washington_University_in_St._Louis,"Washington University has a large number of student-run musical groups on campus, including 12 official a cappella groups. The Pikers, an all-male group, is the oldest such group on campus. The Greenleafs, an all-female group is the oldest (and only) female group on campus. The Mosaic Whispers, founded in 1991, is the oldest co-ed group on campus. They have produced 9 albums and have appeared on a number of compilation albums, including Ben Folds' Ben Folds Presents: University A Cappella! The Amateurs, who also appeared on this album, is another co-ed a cappella group on campus, founded in 1991. They have recorded seven albums and toured extensively. After Dark is a co-ed a cappella group founded in 2001. It has released three albums and has won several Contemporary A Capella Recording (CARA) awards. In 2008 the group performed on MSNBC during coverage of the vice presidential debate with specially written songs about Joe Biden and Sarah Palin. The Ghost Lights, founded in 2010, is the campus's newest and only Broadway, Movies, and Television soundtrack group. They have performed multiple philanthropic concerts in the greater St. Louis area and were honored in November 2010 with the opportunity to perform for Nobel Laureate Douglass North at his birthday celebration.",When did the group After Dark perform MSNBC?,"{'text': ['2008'], 'answer_start': [816]}"
137,572fd2e504bcaa1900d76d8f,Washington_University_in_St._Louis,"Tyson Research Center is a 2,000-acre (809 ha) field station located west of St. Louis on the Meramec River. Washington University obtained Tyson as surplus property from the federal government in 1963. It is used by the University as a biological field station and research/education center. In 2010 the Living Learning Center was named one of the first two buildings accredited nationwide as a ""living building"" under the Living Building Challenge, opened to serve as a biological research station and classroom for summer students.",What is the function of Tyson Research Center?,"{'text': ['a biological field station and research/education center.'], 'answer_start': [235]}"
