,id,title,context,question,answers
377,56d36b3d59d6e41400146340,American_Idol,"Contestants go through at least three sets of cuts. The first is a brief audition with a few other contestants in front of selectors which may include one of the show's producers. Although auditions can exceed 10,000 in each city, only a few hundred of these make it past the preliminary round of auditions. Successful contestants then sing in front of producers, where more may be cut. Only then can they proceed to audition in front of the judges, which is the only audition stage shown on television. Those selected by the judges are sent to Hollywood. Between 10–60 people in each city may make it to Hollywood[citation needed].",Which audition stage is televised?,"{'text': ['the judges'], 'answer_start': [438]}"
378,56f96a3c9e9bad19000a08ef,Marshall_Islands,"United States government assistance is the mainstay of the economy. Under terms of the Amended Compact of Free Association, the U.S. is committed to provide US$57.7 million per year in assistance to the Marshall Islands (RMI) through 2013, and then US$62.7 million through 2023, at which time a trust fund, made up of U.S. and RMI contributions, will begin perpetual annual payouts.",What document defines how much money is transferred from the United States to the Marshall Islands?,"{'text': ['the Amended Compact of Free Association'], 'answer_start': [83]}"
379,5ad221f5d7d075001a4284e7,Antarctica,"Aristotle wrote in his book Meteorology about an Antarctic region in c. 350 B.C. Marinus of Tyre reportedly used the name in his unpreserved world map from the 2nd century A.D. The Roman authors Hyginus and Apuleius (1–2 centuries A.D.) used for the South Pole the romanized Greek name polus antarcticus, from which derived the Old French pole antartike (modern pôle antarctique) attested in 1270, and from there the Middle English pol antartik in a 1391 technical treatise by Geoffrey Chaucer (modern Antarctic Pole).",Who's map is still preserved from the 2nd century A.D,"{'text': [], 'answer_start': []}"
380,5ad12c1a645df0001a2d108a,Universal_Studios,"The Universal Film Manufacturing Company was incorporated in New York on April 30, 1912. Laemmle, who emerged as president in July 1912, was the primary figure in the partnership with Dintenfass, Baumann, Kessel, Powers, Swanson, Horsley, and Brulatour. Eventually all would be bought out by Laemmle. The new Universal studio was a vertically integrated company, with movie production, distribution and exhibition venues all linked in the same corporate entity, the central element of the Studio system era.","What was incorporated in New York on April 30, 1921?","{'text': [], 'answer_start': []}"
381,57334124d058e614000b57dc,Portugal,"The governors of the taifas each proclaimed themselves Emir of their provinces and established diplomatic relations with the Christian kingdoms of the north. Most of Portugal fell into the hands of the Taifa of Badajoz of the Aftasid Dynasty, and after a short spell of an ephemeral Taifa of Lisbon in 1022, fell under the dominion of the Taifa of Seville of the Abbadids poets. The Taifa period ended with the conquest of the Almoravids who came from Morocco in 1086 winning a decisive victory at the Battle of Sagrajas, followed a century later in 1147, after the second period of Taifa, by the Almohads, also from Marrakesh.",What were the governors of the taifas called?,"{'text': ['Emir'], 'answer_start': [55]}"
382,5727b1112ca10214002d9400,Sichuan,"In the middle of the 17th century, the peasant rebel leader Zhang Xianzhong (1606–1646) from Yan'an, Shanxi Province, nicknamed Yellow Tiger, led his peasant troop from north China to the south, and conquered Sichuan. Upon capturing it, he declared himself emperor of the Daxi Dynasty (大西王朝). In response to the resistance from local elites, he massacred a large native population. As a result of the massacre as well as years of turmoil during the Ming-Qing transition, the population of Sichuan fell sharply, requiring a massive resettlement of people from the neighboring Huguang Province (modern Hubei and Hunan) and other provinces during the Qing dynasty.",What was the nickname rebel leader Zhang Xianzhong?,"{'text': ['Yellow Tiger'], 'answer_start': [128]}"
383,56cf5b8eaab44d1400b89108,To_Kill_a_Mockingbird,"Sergel's play toured in the UK starting at West Yorkshire Playhouse in Leeds in 2006, and again in 2011 starting at the York Theatre Royal, both productions featuring Duncan Preston as Atticus Finch. The play also opened the 2013 season at Regent's Park Open Air Theatre in London where it played to full houses and starred Robert Sean Leonard as Atticus Finch, his first London appearance in 22 years. The production is returning to the venue to close the 2014 season, prior to a UK Tour.",The play was the opening act for the starting of the 2013 season at which location?,"{'text': [""Regent's Park Open Air Theatre""], 'answer_start': [240]}"
384,5a4563f819a820001a1eda54,Nonprofit_organization,"Canada allows nonprofits to be incorporated or unincorporated. Nonprofits may incorporate either federally, under Part II of the Canada Business Corporations Act or under provincial legislation. Many of the governing Acts for Canadian nonprofits date to the early 1900s, meaning that nonprofit legislation has not kept pace with legislation that governs for-profit corporations; particularly with regards to corporate governance. Federal, and in some provinces (such as Ontario), incorporation is by way of Letters Patent, and any change to the Letters Patent (even a simple name change) requires formal approval by the appropriate government, as do by-law changes. Other provinces (such as Alberta) permit incorporation as of right, by the filing of Articles of Incorporation or Articles of Association.",What does Canada allow by-law changes to be?,"{'text': [], 'answer_start': []}"
385,5a5191fcb308da001a5a2301,Southeast_Asia,"Homo sapiens reached the region by around 45,000 years ago, having moved eastwards from the Indian subcontinent. Homo floresiensis also lived in the area up until 12,000 years ago, when they became extinct. Austronesian people, who form the majority of the modern population in Indonesia, Malaysia, Brunei, East Timor, and the Philippines, may have migrated to Southeast Asia from Taiwan. They arrived in Indonesia around 2000 BC,and as they spread through the archipelago, they often settled along coastal areas and confined indigenous peoples such as Negritos of the Philippines or Papuans of New Guinea to inland regions.",What reached the region arounf 4500 years ago?,"{'text': [], 'answer_start': []}"
386,5acd272207355d001abf36f4,Estonian_language,"One distinctive feature that has caused a great amount of interest among linguists is what is traditionally seen as three degrees of phonemic length: short, long, and ""overlong"", such that /sɑdɑ/, /sɑˑdɑ/ and /sɑːdɑ/ are distinct. In actuality, the distinction is not purely in the phonemic length, and the underlying phonological mechanism is still disputed.[citation needed]",Who isn't interested in the degrees of phonemic length?,"{'text': [], 'answer_start': []}"
387,572c99202babe914003c299d,Tennessee,"Tennessee politics, like that of most U.S. states, are dominated by the Republican and the Democratic parties. Historian Dewey W. Grantham traces divisions in the state to the period of the American Civil War: for decades afterward, the eastern third of the state was Republican and the western two thirds voted Democrat. This division was related to the state's pattern of farming, plantations and slaveholding. The eastern section was made up of yeoman farmers, but Middle and West Tennessee cultivated crops, such as tobacco and cotton, that were dependent on the use of slave labor. These areas became defined as Democratic after the war.",Which part of Tennessee voted more Republican in the years following the Civil War?,"{'text': ['eastern'], 'answer_start': [237]}"
388,572a19a46aef051400155272,Neolithic,"The beginning of the Neolithic culture is considered to be in the Levant (Jericho, modern-day West Bank) about 10,200 – 8,800 BC. It developed directly from the Epipaleolithic Natufian culture in the region, whose people pioneered the use of wild cereals, which then evolved into true farming. The Natufian period was between 12,000 and 10,200 BC, and the so-called ""proto-Neolithic"" is now included in the Pre-Pottery Neolithic (PPNA) between 10,200 and 8,800 BC. As the Natufians had become dependent on wild cereals in their diet, and a sedentary way of life had begun among them, the climatic changes associated with the Younger Dryas are thought to have forced people to develop farming.",What time period marks the start of Neolithic culture?,"{'text': ['10,200 – 8,800 BC'], 'answer_start': [111]}"
389,5a6b2d63a9e0c9001a4e9f26,Wayback_Machine,"On April 25, 2007, Internet Archive and Suzanne Shell jointly announced the settlement of their lawsuit. The Internet Archive said it ""...has no interest in including materials in the Wayback Machine of persons who do not wish to have their Web content archived. We recognize that Ms. Shell has a valid and enforceable copyright in her Web site and we regret that the inclusion of her Web site in the Wayback Machine resulted in this litigation."" Shell said, ""I respect the historical value of Internet Archive's goal. I never intended to interfere with that goal nor cause it any harm.""",When did Wayback Machine's suit against Internet Archive come to an end?,"{'text': [], 'answer_start': []}"
390,572eb435cb0c0d14000f1491,Endangered_Species_Act,"Fish and Wildlife Service (FWS) and National Marine Fisheries Service (NMFS) are required to create an Endangered Species Recovery Plan outlining the goals, tasks required, likely costs, and estimated timeline to recover endangered species (i.e., increase their numbers and improve their management to the point where they can be removed from the endangered list). The ESA does not specify when a recovery plan must be completed. The FWS has a policy specifying completion within three years of the species being listed, but the average time to completion is approximately six years. The annual rate of recovery plan completion increased steadily from the Ford administration (4) through Carter (9), Reagan (30), Bush I (44), and Clinton (72), but declined under Bush II (16 per year as of 9/1/06).",What is the time limit for completing an Endangered Species Recovery Plan?,"{'text': ['The ESA does not specify when a recovery plan must be completed.'], 'answer_start': [365]}"
391,5ad29b2ed7d075001a429bba,Anthropology,"Waitz was influential among the British ethnologists. In 1863 the explorer Richard Francis Burton and the speech therapist James Hunt broke away from the Ethnological Society of London to form the Anthropological Society of London, which henceforward would follow the path of the new anthropology rather than just ethnology. It was the 2nd society dedicated to general anthropology in existence. Representatives from the French Société were present, though not Broca. In his keynote address, printed in the first volume of its new publication, The Anthropological Review, Hunt stressed the work of Waitz, adopting his definitions as a standard.[n 5] Among the first associates were the young Edward Burnett Tylor, inventor of cultural anthropology, and his brother Alfred Tylor, a geologist. Previously Edward had referred to himself as an ethnologist; subsequently, an anthropologist.",What society did James Hunt form in the 18th century?,"{'text': [], 'answer_start': []}"
392,5acec6ab32bba1001ae4b393,Athanasius_of_Alexandria,"The Gospel of John and particularly the first chapter demonstrates the Divinity of Jesus. This Gospel in itself is the greatest support of Athanasius's stand. The Gospel of John's first chapter began to be said at the end of Mass, we believe as a result of Athanasius, and his life's stand, but quietly. The Last Gospel of The Mass, The Eucharist, St John[1:1–14], together with the prayer; ""Placeat tibi"", the Blessing, are all private devotions that have been gradually absorbed by the liturgical service. The beginning of John's Gospel was much used as an object of special devotion throughout the Middle Ages. Nevertheless, the practice of saying it at the altar grew; eventually Pius V made this practice universal for the Roman Rite in his edition of the Missal (1570). It became a firm custom with exceptions in using an other Gospel in use from 1920. So the Missals showed different last Gospel for certain Feast days. A Prayer Card for the St John's Gospel. Also:", Which of the Gospels most disagrees with Athanasius?,"{'text': [], 'answer_start': []}"
393,572ac9f434ae481900deacdb,Philadelphia,"Historically, Philadelphia sourced its water by the Fairmount Water Works, the nation's first major urban water supply system. In 1909, Water Works was decommissioned as the city transitioned to modern sand filtration methods. Today, the Philadelphia Water Department (PWD) provides drinking water, wastewater collection, and stormwater services for Philadelphia, as well as surrounding counties. PWD draws about 57 percent of its drinking water from the Delaware River and the balance from the Schuylkill River. The public wastewater system consists of three water pollution control plants, 21 pumping stations, and about 3,657 miles of sewers. A 2007 investigation by the Environmental Protection Agency found elevated levels of Iodine-131 in the city's potable water.[citation needed] In 2012, the EPA's readings discovered that the city had the highest readings of I-131 in the nation. The city campaigned against an Associated Press report that the high levels of I-131 were the results of local gas drilling in the Upper Delaware River.[citation needed]",How many miles of sewers are in the city?,"{'text': ['3,657 miles'], 'answer_start': [623]}"
394,56bec3ea3aeaaa14008c93a0,Beyoncé,"Described as being ""sexy, seductive and provocative"" when performing on stage, Beyoncé has said that she originally created the alter ego ""Sasha Fierce"" to keep that stage persona separate from who she really is. She described Sasha as being ""too aggressive, too strong, too sassy [and] too sexy"", stating, ""I'm not like her in real life at all."" Sasha was conceived during the making of ""Crazy in Love"", and Beyoncé introduced her with the release of her 2008 album I Am... Sasha Fierce. In February 2010, she announced in an interview with Allure magazine that she was comfortable enough with herself to no longer need Sasha Fierce. However, Beyoncé announced in May 2012 that she would bring her back for her Revel Presents: Beyoncé Live shows later that month.",Her alter ego was born when according to Beyonce?,"{'text': ['making of ""Crazy in Love""'], 'answer_start': [378]}"
395,573038ab04bcaa1900d773aa,"Santa_Monica,_California","Hundreds of movies have been shot or set in part within the city of Santa Monica. One of the oldest exterior shots in Santa Monica is Buster Keaton's Spite Marriage (1929) which shows much of 2nd Street. The comedy It's a Mad, Mad, Mad, Mad World (1963) included several scenes shot in Santa Monica, including those along the California Incline, which led to the movie's treasure spot, ""The Big W"". The Sylvester Stallone film Rocky III (1982) shows Rocky Balboa and Apollo Creed training to fight Clubber Lang by running on the Santa Monica Beach, and Stallone's Demolition Man (1993) includes Santa Monica settings. Henry Jaglom's indie Someone to Love (1987), the last film in which Orson Welles appeared, takes place in Santa Monica's venerable Mayfair Theatre. Heathers (1989) used Santa Monica's John Adams Middle School for many exterior shots. The Truth About Cats & Dogs (1996) is set entirely in Santa Monica, particularly the Palisades Park area, and features a radio station that resembles KCRW at Santa Monica College. 17 Again (2009) was shot at Samohi. Other films that show significant exterior shots of Santa Monica include Fletch (1985), Species (1995), Get Shorty (1995), and Ocean's Eleven (2001). Richard Rossi's biopic Aimee Semple McPherson opens and closes at the beach in Santa Monica. Iron Man features the Santa Monica pier and surrounding communities as Tony Stark tests his experimental flight suit.",What 1996 movie was set completely in Santa Monica?,"{'text': ['The Truth About Cats & Dogs'], 'answer_start': [852]}"
396,57266235708984140094c460,Chicago_Cubs,"Near the end of the first decade of the double-Bills' guidance, the Cubs won the NL pennant in 1929 and then achieved the unusual feat of winning a pennant every three years, following up the 1929 flag with league titles in 1932, 1935, and 1938. Unfortunately, their success did not extend to the Fall Classic, as they fell to their AL rivals each time. The '32 series against the Yankees featured Babe Ruth's ""called shot"" at Wrigley Field in Game 3. There were some historic moments for the Cubs as well; In 1930, Hack Wilson, one of the top home run hitters in the game, had one of the most impressive seasons in MLB history, hitting 56 home runs and establishing the current runs-batted-in record of 191. That 1930 club, which boasted six eventual Hall of Famers (Wilson, Gabby Hartnett, Rogers Hornsby, George ""High Pockets"" Kelly, Kiki Cuyler and manager Joe McCarthy) established the current team batting average record of .309. In 1935 the Cubs claimed the pennant in thrilling fashion, winning a record 21 games in a row in September. The '38 club saw Dizzy Dean lead the team's pitching staff and provided a historic moment when they won a crucial late-season game at Wrigley Field over the Pittsburgh Pirates with a walk-off home run by Gabby Hartnett, which became known in baseball lore as ""The Homer in the Gloamin'"".",How many games in a row did the Cubs win in a row during 1935?,"{'text': ['21'], 'answer_start': [1012]}"
397,56f8c8829e9bad19000a04d3,Guinea-Bissau,"In September 2003, a military coup was conducted. The military arrested Ialá on the charge of being ""unable to solve the problems"". After being delayed several times, legislative elections were held in March 2004. A mutiny of military factions in October 2004 resulted in the death of the head of the armed forces and caused widespread unrest.",When did the mutiny of military factions occur?,"{'text': ['October 2004'], 'answer_start': [247]}"
398,5727f6982ca10214002d9a57,Time,"Time is one of the seven fundamental physical quantities in both the International System of Units and International System of Quantities. Time is used to define other quantities—such as velocity—so defining time in terms of such quantities would result in circularity of definition. An operational definition of time, wherein one says that observing a certain number of repetitions of one or another standard cyclical event (such as the passage of a free-swinging pendulum) constitutes one standard unit such as the second, is highly useful in the conduct of both advanced experiments and everyday affairs of life. The operational definition leaves aside the question whether there is something called time, apart from the counting activity just mentioned, that flows and that can be measured. Investigations of a single continuum called spacetime bring questions about space into questions about time, questions that have their roots in the works of early students of natural philosophy.",Time is one of the fundamental physical quantities in which two systems?,"{'text': ['the International System of Units and International System of Quantities'], 'answer_start': [65]}"
399,5a4e869d755ab9001a10f4cd,Geological_history_of_Earth,"The Ordovician Period started at a major extinction event called the Cambrian-Ordovician extinction events some time about 485.4 ± 1.9 Ma. During the Ordovician the southern continents were collected into a single continent called Gondwana. Gondwana started the period in the equatorial latitudes and, as the period progressed, drifted toward the South Pole. Early in the Ordovician the continents Laurentia, Siberia and Baltica were still independent continents (since the break-up of the supercontinent Pannotia earlier), but Baltica began to move toward Laurentia later in the period, causing the Iapetus Ocean to shrink between them. Also, Avalonia broke free from Gondwana and began to head north toward Laurentia. The Rheic Ocean was formed as a result of this. By the end of the period, Gondwana had neared or approached the pole and was largely glaciated.",What continent drifted from the South Pole to the equator?,"{'text': [], 'answer_start': []}"
400,56d08aa8234ae51400d9c36c,Solar_energy,"A solar balloon is a black balloon that is filled with ordinary air. As sunlight shines on the balloon, the air inside is heated and expands causing an upward buoyancy force, much like an artificially heated hot air balloon. Some solar balloons are large enough for human flight, but usage is generally limited to the toy market as the surface-area to payload-weight ratio is relatively high.",What is the use of solar balloons typically limited to?,"{'text': ['the toy market'], 'answer_start': [314]}"
401,56d2a28059d6e41400146171,Buddhism,"Buddhism provides many opportunities for comparative study with a diverse range of subjects. For example, Buddhism's emphasis on the Middle way not only provides a unique guideline for ethics but has also allowed Buddhism to peacefully coexist with various differing beliefs, customs and institutions in countries where it has resided throughout its history. Also, its moral and spiritual parallels with other systems of thought—for example, with various tenets of Christianity—have been subjects of close study. In addition, the Buddhist concept of dependent origination has been compared to modern scientific thought, as well as Western metaphysics.",Buddhism had similiar tenets to what other common religion?,"{'text': ['Christianity'], 'answer_start': [465]}"
402,570d9dfadf2f5219002ed05a,Adolescence,"Adolescence marks a time of sexual maturation, which manifests in social interactions as well. While adolescents may engage in casual sexual encounters (often referred to as hookups), most sexual experience during this period of development takes place within romantic relationships. Adolescents can use technologies and social media to seek out romantic relationships as they feel it is a safe place to try out dating and identity exploration. From these social media encounters, a further relationship may begin. Kissing, hand holding, and hugging signify satisfaction and commitment. Among young adolescents, ""heavy"" sexual activity, marked by genital stimulation, is often associated with violence, depression, and poor relationship quality. This effect does not hold true for sexual activity in late adolescence that takes place within a romantic relationship. Some research suggest that there are genetic causes of early sexual activity that are also risk factors for delinquency, suggesting that there is a group who are at risk for both early sexual activity and emotional distress. For old adolescents, though, sexual activity in the context of romantic relationships was actually correlated with lower levels of deviant behavior after controlling for genetic risks, as opposed to sex outside of a relationship (hook-ups)","Where do some adolescents feel is a safe place to seek out romantic relationships, try out dating and indentity exploration?","{'text': ['social media'], 'answer_start': [321]}"
403,56dfe3f5231d4119001abe6d,Pub,"In more recent years, however, many country pubs have either closed down, or have been converted to establishments intent on providing seating facilities for the consumption of food, rather than a venue for members of the local community meeting and convivially drinking.",What is a frequent modern function of country pubs?,"{'text': ['providing seating facilities for the consumption of food'], 'answer_start': [125]}"
404,5ad5fea45b96ef001a10afdf,Comprehensive_school,"The first comprehensives were set up after the Second World War. In 1946, for example, Walworth School was one of five 'experimental' comprehensive schools set up by the London County Council Another early comprehensive school was Holyhead County School in Anglesey in 1949. Other early examples of comprehensive schools included Woodlands Boys School in Coventry (opened in 1954) and Tividale Comprehensive School in Tipton.",When was Holyhead County School closed?,"{'text': [], 'answer_start': []}"
405,5a65e2dec2b11c001a425db3,Antibiotics,"There has been extensive use of antibiotics in animal husbandry. In the United States, the question of emergence of antibiotic-resistant bacterial strains due to use of antibiotics in livestock was raised by the US Food and Drug Administration (FDA) in 1977. In March 2012, the United States District Court for the Southern District of New York, ruling in an action brought by the Natural Resources Defense Council and others, ordered the FDA to revoke approvals for the use of antibiotics in livestock, which violated FDA regulations.",When did a district court order the FDA to stop approving animals?,"{'text': [], 'answer_start': []}"
