,id,title,context,question,answers
0,56e0f3907aa994140058e80a,Canon_law,The Roman Catholic Church canon law also includes the main five rites (groups) of churches which are in full union with the Roman Catholic Church and the Supreme Pontiff:,What term characterizes the intersection of the rites with the Roman Catholic Church?,"{'text': ['full union'], 'answer_start': [104]}"
1,571adcf932177014007e9f56,Athanasius_of_Alexandria,"Alexandria was the most important trade center in the whole empire during Athanasius's boyhood. Intellectually, morally, and politically—it epitomized the ethnically diverse Graeco-Roman world, even more than Rome or Constantinople, Antioch or Marseilles. Its famous catechetical school, while sacrificing none of its famous passion for orthodoxy since the days of Pantaenus, Clement of Alexandria, Origen of Alexandria, Dionysius and Theognostus, had begun to take on an almost secular character in the comprehensiveness of its interests, and had counted influential pagans among its serious auditors.",What was Alexandria known for?,"{'text': ['important trade center'], 'answer_start': [24]}"
2,57325b9fe99e3014001e670c,Jehovah%27s_Witnesses,"Former members Heather and Gary Botting compare the cultural paradigms of the religion to George Orwell's Nineteen Eighty-four, and Alan Rogerson describes the religion's leadership as totalitarian. Other critics charge that by disparaging individual decision-making, the religion's leaders cultivate a system of unquestioning obedience in which Witnesses abrogate all responsibility and rights over their personal lives. Critics also accuse the religion's leaders of exercising ""intellectual dominance"" over Witnesses, controlling information and creating ""mental isolation"", which former Governing Body member Raymond Franz argued were all elements of mind control.",How do the leaders of the Jehovah's Witnesses cultivate a system of unquestioning obedience?,"{'text': ['disparaging individual decision-making'], 'answer_start': [228]}"
3,5728d8be4b864d1900164f6b,Estonia,"Historically, the cuisine of Estonia has been heavily dependent on seasons and simple peasant food, which today is influenced by many countries. Today, it includes many typical international foods.[citation needed] The most typical foods in Estonia are black bread, pork, potatoes, and dairy products. Traditionally in summer and spring, Estonians like to eat everything fresh – berries, herbs, vegetables, and everything else that comes straight from the garden. Hunting and fishing have also been very common, although currently hunting and fishing are enjoyed mostly as hobbies. Today, it is also very popular to grill outside in summer.",What are the most common foods in Estonia?,"{'text': ['black bread, pork, potatoes, and dairy products.'], 'answer_start': [253]}"
4,56f6f5e1711bf01900a44898,Classical_music,"Many of the instruments used to perform medieval music still exist, but in different forms. Medieval instruments included the wood flute (which in the 21st century is made of metal), the recorder and plucked string instruments like the lute. As well, early versions of the organ, fiddle (or vielle), and trombone (called the sackbut) existed. Medieval instruments in Europe had most commonly been used singly, often self accompanied with a drone note, or occasionally in parts. From at least as early as the 13th century through the 15th century there was a division of instruments into haut (loud, shrill, outdoor instruments) and bas (quieter, more intimate instruments).",What was the medieval flute made from?,"{'text': ['wood'], 'answer_start': [126]}"
5,5a36fffb95360f001af1b3c1,Gregorian_calendar,"Prior to 1917, Turkey used the lunar Islamic calendar with the Hegira era for general purposes and the Julian calendar for fiscal purposes. The start of the fiscal year was eventually fixed at 1 March and the year number was roughly equivalent to the Hegira year (see Rumi calendar). As the solar year is longer than the lunar year this originally entailed the use of ""escape years"" every so often when the number of the fiscal year would jump. From 1 March 1917 the fiscal year became Gregorian, rather than Julian. On 1 January 1926 the use of the Gregorian calendar was extended to include use for general purposes and the number of the year became the same as in other countries.",What was used to set the year number?,"{'text': [], 'answer_start': []}"
6,5728fd38af94a219006a9edd,Samurai,"Bushi was the name given to the ancient Japanese soldiers from traditional warrior families. The bushi class was developed mainly in the north of Japan. They formed powerful clans, which in the 12th century were against the noble families who were grouping themselves to support the imperial family who lived in Kyoto. Samurai was a word used by the Kuge aristocratic class with warriors themselves preferring the word bushi. The term Bushidō, the ""way of the warrior"", is derived from this term and the mansion of a warrior was called bukeyashiki.",Where did the imperial family live?,"{'text': ['Kyoto'], 'answer_start': [312]}"
7,5726c774f1498d1400e8eb0d,Utrecht,"When the Frankish rulers established the system of feudalism, the Bishops of Utrecht came to exercise worldly power as prince-bishops. The territory of the bishopric not only included the modern province of Utrecht (Nedersticht, 'lower Sticht'), but also extended to the northeast. The feudal conflict of the Middle Ages heavily affected Utrecht. The prince-bishopric was involved in almost continuous conflicts with the Counts of Holland and the Dukes of Guelders. The Veluwe region was seized by Guelders, but large areas in the modern province of Overijssel remained as the Oversticht.",What was part of the territory of bishopric ,"{'text': [""not only included the modern province of Utrecht (Nedersticht, 'lower Sticht'), but also extended to the northeast""], 'answer_start': [166]}"
8,57264da2dd62a815002e8108,Department_store,"A novelty shop called Au Bon Marché had been founded in Paris in 1838 to sell lace, ribbons, sheets, mattresses, buttons, umbrellas and other assorted goods. It originally had four departments, twelve employees, and a floor space of three hundred meters. The entrepreneur Aristide Boucicaut became a partner in 1852, and changed the marketing plan, instituting fixed prices and guarantees that allowed exchanges and refunds, advertising, and a much wider variety of merchandise. The annual income of the store increased from 500,000 francs in 1852 to five million in 1860. In 1869 he built much larger building at 24 rue de Sèvres on the Left Bank, and enlarged the store again in 1872, with help from the engineering firm of Gustave Eiffel, creator of the Eiffel Tower. The income rose from twenty million francs in 1870 to 72 million at the time of the Boucicaut's death in 1877. The floor space had increased from three hundred square meters in 1838 to fifty thousand, and the number of employees had increased from twelve in 1838 to 1788 in 1879. Boucicaut was famous for his marketing innovations; a reading room for husbands while their wives shopped; extensive newspaper advertising; entertainment for children; and six million catalogs sent out to customers. By 1880 half the employees were women; unmarried women employees lived in dormitories on the upper floors.",What was the change in profit to Au Bon Marche after these changes? ,"{'text': ['increased from 500,000 francs in 1852 to five million in 1860'], 'answer_start': [510]}"
9,56fdeee819033b140034cde7,Computer,"Machine languages and the assembly languages that represent them (collectively termed low-level programming languages) tend to be unique to a particular type of computer. For instance, an ARM architecture computer (such as may be found in a PDA or a hand-held videogame) cannot understand the machine language of an Intel Pentium or the AMD Athlon 64 computer that might be in a PC.",An ARM architecture computer can be found in what?,"{'text': ['a PDA or a hand-held videogame'], 'answer_start': [239]}"
10,56fb84ebb28b3419009f1de7,Middle_Ages,"During this period the practice of manuscript illumination gradually passed from monasteries to lay workshops, so that according to Janetta Benton ""by 1300 most monks bought their books in shops"", and the book of hours developed as a form of devotional book for lay-people. Metalwork continued to be the most prestigious form of art, with Limoges enamel a popular and relatively affordable option for objects such as reliquaries and crosses. In Italy the innovations of Cimabue and Duccio, followed by the Trecento master Giotto (d. 1337), greatly increased the sophistication and status of panel painting and fresco. Increasing prosperity during the 12th century resulted in greater production of secular art; many carved ivory objects such as gaming-pieces, combs, and small religious figures have survived.",What were many pieces of secular art carved from in this period?,"{'text': ['ivory'], 'answer_start': [723]}"
11,57325c2fe99e3014001e6716,Jehovah%27s_Witnesses,"Sociologist Rodney Stark states that Jehovah's Witness leaders are ""not always very democratic"" and that members ""are expected to conform to rather strict standards,"" but adds that ""enforcement tends to be very informal, sustained by the close bonds of friendship within the group"", and that Jehovah's Witnesses see themselves as ""part of the power structure rather than subject to it."" Sociologist Andrew Holden states that most members who join millenarian movements such as Jehovah's Witnesses have made an informed choice. However, he also states that defectors ""are seldom allowed a dignified exit"", and describes the administration as autocratic.",How do Jehovah's Witnesses see themselves in regards to the power structure of the church?,"{'text': ['""part of the power structure rather than subject to it.""'], 'answer_start': [330]}"
12,56e43a6e8c00841900fbaf42,Estonian_language,"Although the Estonian and Germanic languages are of very different origins, one can identify many similar words in Estonian and English, for example. This is primarily because the Estonian language has borrowed nearly one third of its vocabulary from Germanic languages, mainly from Low Saxon (Middle Low German) during the period of German rule, and High German (including standard German). The percentage of Low Saxon and High German loanwords can be estimated at 22–25 percent, with Low Saxon making up about 15 percent.[citation needed]",From what other Germanic language does Estonian derive its vocabulary?,"{'text': ['High German'], 'answer_start': [351]}"
13,572723b8dd62a815002e9957,Capacitor,"Capacitors may retain a charge long after power is removed from a circuit; this charge can cause dangerous or even potentially fatal shocks or damage connected equipment. For example, even a seemingly innocuous device such as a disposable-camera flash unit, powered by a 1.5 volt AA battery, has a capacitor which may contain over 15 joules of energy and be charged to over 300 volts. This is easily capable of delivering a shock. Service procedures for electronic devices usually include instructions to discharge large or high-voltage capacitors, for instance using a Brinkley stick. Capacitors may also have built-in discharge resistors to dissipate stored energy to a safe level within a few seconds after power is removed. High-voltage capacitors are stored with the terminals shorted, as protection from potentially dangerous voltages due to dielectric absorption or from transient voltages the capacitor may pick up from static charges or passing weather events.",How are the terminals of high voltage capacitors stored?,"{'text': ['with the terminals shorted'], 'answer_start': [763]}"
14,572686975951b619008f75a3,Chicago_Cubs,"The Cubs' current spring training facility is located in Sloan Park in |Mesa, Arizona, where they play in the Cactus League. The park seats 15,000, making it Major League baseball's largest spring training facility by capacity. The Cubs annually sell out most of their games both at home and on the road. Before Sloan Park opened in 2014, the team played games at HoHoKam Park - Dwight Patterson Field from 1979. ""HoHoKam"" is literally translated from Native American as ""those who vanished."" The North Siders have called Mesa their spring home for most seasons since 1952.",Where is the Cubs' current spring  training facility located?,"{'text': ['Sloan Park'], 'answer_start': [57]}"
15,56e7ba3537bdd419002c43d1,Nanjing,"As a major Chinese city, Nanjing is home to many professional sports teams. Jiangsu Sainty, the football club currently staying in Chinese Super League, is a long-term tenant of Nanjing Olympic Sports Center. Jiangsu Nangang Basketball Club is a competitive team which has long been one of the major clubs fighting for the title in China top level league, CBA. Jiangsu Volleyball men and women teams are also traditionally considered as at top level in China volleyball league.",What is the name of the football club in Nanjing?,"{'text': ['Jiangsu Sainty'], 'answer_start': [76]}"
16,56fa5330f34c681400b0c07b,Wood,"Wood unsuitable for construction in its native form may be broken down mechanically (into fibers or chips) or chemically (into cellulose) and used as a raw material for other building materials, such as engineered wood, as well as chipboard, hardboard, and medium-density fiberboard (MDF). Such wood derivatives are widely used: wood fibers are an important component of most paper, and cellulose is used as a component of some synthetic materials. Wood derivatives can also be used for kinds of flooring, for example laminate flooring.",What material results from chemically breaking down wood?,"{'text': ['cellulose'], 'answer_start': [127]}"
17,570700329e06ca38007e9299,Letter_case,"Letter case is often prescribed by the grammar of a language or by the conventions of a particular discipline. In orthography, the uppercase is primarily reserved for special purposes, such as the first letter of a sentence or of a proper noun, which makes the lowercase the more common variant in text. In mathematics, letter case may indicate the relationship between objects with uppercase letters often representing ""superior"" objects (e.g. X could be a set containing the generic member x). Engineering design drawings are typically labelled entirely in upper-case letters, which are easier to distinguish than lowercase, especially when space restrictions require that the lettering be small.",Which is the most common variant of case in text?,"{'text': ['lowercase'], 'answer_start': [261]}"
18,56f762fbaef2371900625b90,Slavs,"Conversely, some Slavs were assimilated into other populations. Although the majority continued south, attracted by the riches of the territory which would become Bulgaria, a few remained in the Carpathian basin and were ultimately assimilated into the Magyar or Romanian population. There is a large number of river names and other placenames of Slavic origin in Romania.[better source needed]",Where did the Slavs that assimilated into the Magyar or Romanian population remain?,"{'text': ['Carpathian basin'], 'answer_start': [195]}"
19,56f8220daef2371900625e0a,Szlachta,"In 1430 with the Privileges of Jedlnia, confirmed at Kraków in 1433 (Polish: ""przywileje jedlneńsko-krakowskie""), based partially on his earlier Brześć Kujawski privilege (April 25, 1425), King Władysław II Jagiełło granted the nobility a guarantee against arbitrary arrest, similar to the English Magna Carta's Habeas corpus, known from its own Latin name as ""neminem captivabimus (nisi jure victum)."" Henceforth no member of the nobility could be imprisoned without a warrant from a court of justice: the king could neither punish nor imprison any noble at his whim. King Władysław's quid pro quo for this boon was the nobles' guarantee that his throne would be inherited by one of his sons (who would be bound to honour the privileges theretofore granted to the nobility). On May 2, 1447 the same king issued the Wilno Privilege which gave the Lithuanian boyars the same rights as those possessed by the Polish szlachta.",What does a court need to imprison a member of the nobility? ,"{'text': ['warrant from a court of justice'], 'answer_start': [470]}"
20,5727c05f3acd2414000deb85,Rule_of_law,"In 1607, English Chief Justice Sir Edward Coke said in the Case of Prohibitions (according to his own report) ""that the law was the golden met-wand and measure to try the causes of the subjects; and which protected His Majesty in safety and peace: with which the King was greatly offended, and said, that then he should be under the law, which was treason to affirm, as he said; to which I said, that Bracton saith, quod Rex non debed esse sub homine, sed sub Deo et lege (That the King ought not to be under any man but under God and the law.).""",When did English Chief Justice Sir Edward Coke speak in the Case of Prohibitions?,"{'text': ['1607'], 'answer_start': [3]}"
21,5a0803c33fc8740018207115,Infrared,"Earth's surface and the clouds absorb visible and invisible radiation from the sun and re-emit much of the energy as infrared back to atmosphere. Certain substances in the atmosphere, chiefly cloud droplets and water vapor, but also carbon dioxide, methane, nitrous oxide, sulfur hexafluoride, and chlorofluorocarbons, absorb this infrared, and re-radiate it in all directions including back to Earth. Thus, the greenhouse effect keeps the atmosphere and surface much warmer than if the infrared absorbers were absent from the atmosphere.",What substances emit water vapor back to the atmosphere?,"{'text': [], 'answer_start': []}"
22,5a811e7a31013a001a334b90,Time,"The theory of special relativity finds a convenient formulation in Minkowski spacetime, a mathematical structure that combines three dimensions of space with a single dimension of time. In this formalism, distances in space can be measured by how long light takes to travel that distance, e.g., a light-year is a measure of distance, and a meter is now defined in terms of how far light travels in a certain amount of time. Two events in Minkowski spacetime are separated by an invariant interval, which can be either space-like, light-like, or time-like. Events that have a time-like separation cannot be simultaneous in any frame of reference, there must be a temporal component (and possibly a spatial one) to their separation. Events that have a space-like separation will be simultaneous in some frame of reference, and there is no frame of reference in which they do not have a spatial separation. Different observers may calculate different distances and different time intervals between two events, but the invariant interval between the events is independent of the observer (and his velocity).",What is the invariant interval between time is independent of?,"{'text': [], 'answer_start': []}"
23,5706950a52bb891400689a9f,House_music,"In the late 1980s, many local Chicago house music artists suddenly found themselves presented with major label deals. House music proved to be a commercially successful genre and a more mainstream pop-based variation grew increasingly popular. Artists and groups such as Madonna, Janet Jackson, Paula Abdul, Aretha Franklin, Bananarama, Diana Ross, Tina Turner, Whitney Houston, Steps, Kylie Minogue, Bjork, and C+C Music Factoryhave all incorporated the genre into some of their work. After enjoying significant success in the early to mid-90s, house music grew even larger during the second wave of progressive house (1999–2001). The genre has remained popular and fused into other popular subgenres, for example, G-house, Deep House, Tech House and Bass House. As of 2015, house music remains extremely popular in both clubs and in the mainstream pop scene while retaining a foothold on underground scenes across the globe.[citation needed]",What variation of house music was produced by artists such as Madonna and Kylie Minogue?,"{'text': ['a more mainstream pop-based variation'], 'answer_start': [179]}"
24,5730be6a2461fd1900a9d03c,Tuvalu,"The next European to visit was Arent Schuyler de Peyster, of New York, captain of the armed brigantine or privateer Rebecca, sailing under British colours, which passed through the southern Tuvaluan waters in May 1819; de Peyster sighted Nukufetau and Funafuti, which he named Ellice's Island after an English Politician, Edward Ellice, the Member of Parliament for Coventry and the owner of the Rebecca's cargo. The name Ellice was applied to all nine islands after the work of English hydrographer Alexander George Findlay.",Which of the Tuvalu isalnds did de Peyster see?,"{'text': ['Nukufetau and Funafuti'], 'answer_start': [238]}"
25,5a8cb0dcfd22b3001a8d8d3e,Biodiversity,"Biodiversity provides critical support for drug discovery and the availability of medicinal resources. A significant proportion of drugs are derived, directly or indirectly, from biological sources: at least 50% of the pharmaceutical compounds on the US market are derived from plants, animals, and micro-organisms, while about 80% of the world population depends on medicines from nature (used in either modern or traditional medical practice) for primary healthcare. Only a tiny fraction of wild species has been investigated for medical potential. Biodiversity has been critical to advances throughout the field of bionics. Evidence from market analysis and biodiversity science indicates that the decline in output from the pharmaceutical sector since the mid-1980s can be attributed to a move away from natural product exploration (""bioprospecting"") in favor of genomics and synthetic chemistry, indeed claims about the value of undiscovered pharmaceuticals may not provide enough incentive for companies in free markets to search for them because of the high cost of development; meanwhile, natural products have a long history of supporting significant economic and health innovation. Marine ecosystems are particularly important, although inappropriate bioprospecting can increase biodiversity loss, as well as violating the laws of the communities and states from which the resources are taken.",What provides critical support for drug discovery and the availability of economic resources?,"{'text': [], 'answer_start': []}"
26,5726ad27f1498d1400e8e6df,Botany,"20th century developments in plant biochemistry have been driven by modern techniques of organic chemical analysis, such as spectroscopy, chromatography and electrophoresis. With the rise of the related molecular-scale biological approaches of molecular biology, genomics, proteomics and metabolomics, the relationship between the plant genome and most aspects of the biochemistry, physiology, morphology and behaviour of plants can be subjected to detailed experimental analysis. The concept originally stated by Gottlieb Haberlandt in 1902 that all plant cells are totipotent and can be grown in vitro ultimately enabled the use of genetic engineering experimentally to knock out a gene or genes responsible for a specific trait, or to add genes such as GFP that report when a gene of interest is being expressed. These technologies enable the biotechnological use of whole plants or plant cell cultures grown in bioreactors to synthesise pesticides, antibiotics or other pharmaceuticals, as well as the practical application of genetically modified crops designed for traits such as improved yield.",What opened the door to plant genetic engineering?,"{'text': ['all plant cells are totipotent'], 'answer_start': [547]}"
27,5733612b4776f41900660936,Financial_crisis_of_2007%E2%80%9308,"The financial crisis was not widely predicted by mainstream economists except Raghuram Rajan, who instead spoke of the Great Moderation. A number of heterodox economists predicted the crisis, with varying arguments. Dirk Bezemer in his research credits (with supporting argument and estimates of timing) 12 economists with predicting the crisis: Dean Baker (US), Wynne Godley (UK), Fred Harrison (UK), Michael Hudson (US), Eric Janszen (US), Steve Keen (Australia), Jakob Brøchner Madsen & Jens Kjaer Sørensen (Denmark), Kurt Richebächer (US), Nouriel Roubini (US), Peter Schiff (US), and Robert Shiller (US). Examples of other experts who gave indications of a financial crisis have also been given. Not surprisingly, the Austrian economic school regarded the crisis as a vindication and classic example of a predictable credit-fueled bubble that could not forestall the disregarded but inevitable effect of an artificial, manufactured laxity in monetary supply, a perspective that even former Fed Chair Alan Greenspan in Congressional testimony confessed himself forced to return to.",Which former Fed Chair confessed in Congressional testimony to being forced to return to lax monetary supply?,"{'text': ['Alan Greenspan'], 'answer_start': [1005]}"
28,56e19227cd28a01900c679d2,Catalan_language,"In Western Catalan, unstressed vowels reduce to five: /e ɛ/ > [e]; /o ɔ/ > [o]; /a u i/ remain distinct. This reduction pattern, inherited from Proto-Romance, is also found in Italian and Portuguese. Some Western dialects present further reduction or vowel harmony in some cases.",Which letters remain distinct?,"{'text': ['/a u i/'], 'answer_start': [80]}"
