,id,title,context,question,answers
248,570652ab75f01819005e7b4a,Black_people,"In early 1991, non-Arabs of the Zaghawa tribe of Sudan attested that they were victims of an intensifying Arab apartheid campaign, segregating Arabs and non-Arabs (specifically people of sub-Saharan African descent). Sudanese Arabs, who controlled the government, were widely referred to as practicing apartheid against Sudan's non-Arab citizens. The government was accused of ""deftly manipulat(ing) Arab solidarity"" to carry out policies of apartheid and ethnic cleansing.",What was the government being accused of?,"{'text': ['deftly manipulat(ing) Arab solidarity"" to carry out policies of apartheid and ethnic cleansing.'], 'answer_start': [378]}"
249,56be8bab3aeaaa14008c90a0,Beyoncé,"At age eight, Beyoncé and childhood friend Kelly Rowland met LaTavia Roberson while in an audition for an all-girl entertainment group. They were placed into a group with three other girls as Girl's Tyme, and rapped and danced on the talent show circuit in Houston. After seeing the group, R&B producer Arne Frager brought them to his Northern California studio and placed them in Star Search, the largest talent show on national TV at the time. Girl's Tyme failed to win, and Beyoncé later said the song they performed was not good. In 1995 Beyoncé's father resigned from his job to manage the group. The move reduced Beyoncé's family's income by half, and her parents were forced to move into separated apartments. Mathew cut the original line-up to four and the group continued performing as an opening act for other established R&B girl groups. The girls auditioned before record labels and were finally signed to Elektra Records, moving to Atlanta Records briefly to work on their first recording, only to be cut by the company. This put further strain on the family, and Beyoncé's parents separated. On October 5, 1995, Dwayne Wiggins's Grass Roots Entertainment signed the group. In 1996, the girls began recording their debut album under an agreement with Sony Music, the Knowles family reunited, and shortly after, the group got a contract with Columbia Records.","In 1995, who decided to manage the girls singing group?","{'text': [""Beyoncé's father""], 'answer_start': [542]}"
250,56ce75d4aab44d1400b887bd,IPod,"Though the iPod was released in 2001, its price and Mac-only compatibility caused sales to be relatively slow until 2004. The iPod line came from Apple's ""digital hub"" category, when the company began creating software for the growing market of personal digital devices. Digital cameras, camcorders and organizers had well-established mainstream markets, but the company found existing digital music players ""big and clunky or small and useless"" with user interfaces that were ""unbelievably awful,"" so Apple decided to develop its own. As ordered by CEO Steve Jobs, Apple's hardware engineering chief Jon Rubinstein assembled a team of engineers to design the iPod line, including hardware engineers Tony Fadell and Michael Dhuey, and design engineer Sir Jonathan Ive. Rubinstein had already discovered the Toshiba disk drive when meeting with an Apple supplier in Japan, and purchased the rights to it for Apple, and had also already worked out how the screen, battery, and other key elements would work. The aesthetic was inspired by the 1958 Braun T3 transistor radio designed by Dieter Rams, while the wheel based user interface was prompted by Bang & Olufsen's BeoCom 6000 telephone. The product (""the Walkman of the twenty-first century"" ) was developed in less than one year and unveiled on October 23, 2001. Jobs announced it as a Mac-compatible product with a 5 GB hard drive that put ""1,000 songs in your pocket.""",in what year was the original iPod released?,"{'text': ['2001'], 'answer_start': [32]}"
251,572a20041d046914007797b6,Neolithic,"Domestication of sheep and goats reached Egypt from the Near East possibly as early as 6,000 BC. Graeme Barker states ""The first indisputable evidence for domestic plants and animals in the Nile valley is not until the early fifth millennium bc in northern Egypt and a thousand years later further south, in both cases as part of strategies that still relied heavily on fishing, hunting, and the gathering of wild plants"" and suggests that these subsistence changes were not due to farmers migrating from the Near East but was an indigenous development, with cereals either indigenous or obtained through exchange. Other scholars argue that the primary stimulus for agriculture and domesticated animals (as well as mud-brick architecture and other Neolithic cultural features) in Egypt was from the Middle East.",How did Egyptians gather food before raising livestock?,"{'text': ['fishing, hunting, and the gathering of wild plants'], 'answer_start': [370]}"
252,5ad3d467604f3c001a3ff2ab,Yale_University,"In 1909–10, football faced a crisis resulting from the failure of the previous reforms of 1905–06 to solve the problem of serious injuries. There was a mood of alarm and mistrust, and, while the crisis was developing, the presidents of Harvard, Yale, and Princeton developed a project to reform the sport and forestall possible radical changes forced by government upon the sport. President Arthur Hadley of Yale, A. Lawrence Lowell of Harvard, and Woodrow Wilson of Princeton worked to develop moderate changes to reduce injuries. Their attempts, however, were reduced by rebellion against the rules committee and formation of the Intercollegiate Athletic Association. The big three had tried to operate independently of the majority, but changes did reduce injuries.",Who represented Princeton before the rule changing discussions?,"{'text': [], 'answer_start': []}"
253,56daf4e0e7c41114004b4b9b,2008_Summer_Olympics_torch_relay,"In many cities along the North American and European route, the torch relay was protested by advocates of Tibetan independence, animal rights, and legal online gambling, and people protesting against China's human rights record, resulting in confrontations at a few of the relay locations. These protests, which ranged from hundreds of people in San Francisco, to effectively none in Pyongyang, forced the path of the torch relay to be changed or shortened on a number of occasions. The torch was extinguished by Chinese security officials several times during the Paris leg for security reasons, and once in protest in Paris.",What were some groups doing along the torch route that was not supportive of the Olympics?,"{'text': ['protesting'], 'answer_start': [181]}"
254,5730eef6a5e9cc1400cdbb09,Russian_language,"In the Southern Russian dialects, instances of unstressed /e/ and /a/ following palatalized consonants and preceding a stressed syllable are not reduced to [ɪ] (as occurs in the Moscow dialect), being instead pronounced [a] in such positions (e.g. несли is pronounced [nʲaˈslʲi], not [nʲɪsˈlʲi]) – this is called yakanye/яканье. Consonants include a fricative /ɣ/, a semivowel /w~u̯/ and /x~xv~xw/, whereas the Standard and Northern dialects have the consonants /ɡ/, /v/, and final /l/ and /f/, respectively. The morphology features a palatalized final /tʲ/ in 3rd person forms of verbs (this is unpalatalized in the Standard and Northern dialects). Some of these features such as akanye/yakanye, a debuccalized or lenited /ɡ/, a semivowel /w~u̯/ and palatalized final /tʲ/ in 3rd person forms of verbs are also present in modern Belarusian and some dialects of Ukrainian (Eastern Polesian), indicating a linguistic continuum.",What does Southern Russian have a linguistic continuum with?,"{'text': ['modern Belarusian and some dialects of Ukrainian (Eastern Polesian)'], 'answer_start': [823]}"
255,570a79de4103511400d59758,Emotion,"Subsequent to these developments, Randall Collins (2004) formulated his interaction ritual theory by drawing on Durkheim's work on totemic rituals that was extended by Goffman (1964/2013; 1967) into everyday focused encounters. Based on interaction ritual theory, we experience different levels or intensities of emotional energy during face-to-face interactions. Emotional energy is considered to be a feeling of confidence to take action and a boldness that one experiences when they are charged up from the collective effervescence generated during group gatherings that reach high levels of intensity.","In addition to Durkheim, whose work influenced the development of interaction ritual theory?","{'text': ['Goffman'], 'answer_start': [168]}"
256,5acd8e2b07355d001abf4704,British_Isles,"Many larger animals, such as wolf, bear and the European elk are today extinct. However, some species such as red deer are protected. Other small mammals, such as rabbits, foxes, badgers, hares, hedgehogs, and stoats, are very common and the European beaver has been reintroduced in parts of Scotland. Wild boar have also been reintroduced to parts of southern England, following escapes from boar farms and illegal releases. Many rivers contain otters and seals are common on coasts. Over 200 species of bird reside permanently and another 200 migrate. Common types are the common chaffinch, common blackbird, house sparrow and common starling; all small birds. Large birds are declining in number, except for those kept for game such as pheasant, partridge, and red grouse. Fish are abundant in the rivers and lakes, in particular salmon, trout, perch and pike. Sea fish include dogfish, cod, sole, pollock and bass, as well as mussels, crab and oysters along the coast. There are more than 21,000 species of insects.",Where are seals and otters uncommon?,"{'text': [], 'answer_start': []}"
257,5ad39448604f3c001a3fe70a,Federal_Bureau_of_Investigation,"The FBI is organized into functional branches and the Office of the Director, which contains most administrative offices. An executive assistant director manages each branch. Each branch is then divided into offices and divisions, each headed by an assistant director. The various divisions are further divided into sub-branches, led by deputy assistant directors. Within these sub-branches there are various sections headed by section chiefs. Section chiefs are ranked analogous to special agents in charge.",Who manages each CIA branch?,"{'text': [], 'answer_start': []}"
258,56e098707aa994140058e606,Russian_Soviet_Federative_Socialist_Republic,"The Russian Soviet Federative Socialist Republic (Russian SFSR or RSFSR; Russian: Российская Советская Федеративная Социалистическая Республика, tr. Rossiyskaya Sovetskaya Federativnaya Sotsialisticheskaya Respublika  listen (help·info)) commonly referred to as Soviet Russia or simply as Russia, was a sovereign state in 1917–22, the largest, most populous, and most economically developed republic of the Soviet Union in 1922–91 and a sovereign part of the Soviet Union with its own legislation in 1990–91. The Republic comprised sixteen autonomous republics, five autonomous oblasts, ten autonomous okrugs, six krais, and forty oblasts. Russians formed the largest ethnic group. To the west it bordered Finland, Norway and Poland; and to the south, China, Mongolia and North Korea whilst bordering the Arctic Ocean to the north, the Pacific Ocean to the east and the Black sea and Caspian Sea to the south. Within the USSR, it bordered the Baltic republics (Lithuania, Latvia and Estonia), the Byelorussian SSR and the Ukrainian SSR to the west. To the south it bordered the Georgian, Azerbaijan and Kazakh SSRs.",How many autonomous republics make up the RSFSR?,"{'text': ['sixteen'], 'answer_start': [532]}"
259,5727e6212ca10214002d9908,Gramophone_record,"Vinyl records can be warped by heat, improper storage, exposure to sunlight, or manufacturing defects such as excessively tight plastic shrinkwrap on the album cover. A small degree of warp was common, and allowing for it was part of the art of turntable and tonearm design. ""wow"" (once-per-revolution pitch variation) could result from warp, or from a spindle hole that was not precisely centered. Standard practice for LPs was to place the LP in a paper or plastic inner cover. This, if placed within the outer cardboard cover so that the opening was entirely within the outer cover, was said to reduce ingress of dust onto the record surface. Singles, with rare exceptions, had simple paper covers with no inner cover.",What method was used to protect a vinyl record?,"{'text': ['place the LP in a paper or plastic inner cover'], 'answer_start': [432]}"
260,5709a3e9ed30961900e843aa,Race_and_ethnicity_in_the_United_States_Census,"President Franklin D. Roosevelt promoted a ""good neighbor"" policy that sought better relations with Mexico. In 1935 a federal judge ruled that three Mexican immigrants were ineligible for citizenship because they were not white, as required by federal law. Mexico protested, and Roosevelt decided to circumvent the decision and make sure the federal government treated Hispanics as white. The State Department, the Census Bureau, the Labor Department, and other government agencies therefore made sure to uniformly classify people of Mexican descent as white. This policy encouraged the League of United Latin American Citizens in its quest to minimize discrimination by asserting their whiteness.",What US President wanted to treat Hispanic people as white by the federal government?,"{'text': ['Roosevelt'], 'answer_start': [279]}"
261,570dfbd20b85d914000d7c5a,Antarctica,"Meteorites from Antarctica are an important area of study of material formed early in the solar system; most are thought to come from asteroids, but some may have originated on larger planets. The first meteorite was found in 1912, and named the Adelie Land meteorite. In 1969, a Japanese expedition discovered nine meteorites. Most of these meteorites have fallen onto the ice sheet in the last million years. Motion of the ice sheet tends to concentrate the meteorites at blocking locations such as mountain ranges, with wind erosion bringing them to the surface after centuries beneath accumulated snowfall. Compared with meteorites collected in more temperate regions on Earth, the Antarctic meteorites are well-preserved.",What expedition found nine meteorites in 1969?,"{'text': ['Japanese'], 'answer_start': [280]}"
262,5726c641708984140094d123,Crimean_War,"The immediate chain of events leading to France and the United Kingdom declaring war on Russia on 27 and 28 March 1854 came from the ambition of the French emperor Napoleon III to restore the grandeur of France. He wanted Catholic support that would come his way if he attacked Eastern Orthodoxy, as sponsored by Russia.:103 The Marquis Charles de La Valette was a zealous Catholic and a leading member of the ""clerical party,"" which demanded French protection of the Roman Catholic rights to the holy places in Palestine. In May 1851, Napoleon appointed La Valette as his ambassador to the Porte (the Ottoman Empire).:7–9 The appointment was made with the intent of forcing the Ottomans to recognise France as the ""sovereign authority"" over the Christian population.:19 Russia disputed this attempted change in authority. Pointing to two more treaties, one in 1757 and the 1774 Treaty of Küçük Kaynarca, the Ottomans reversed their earlier decision, renouncing the French treaty and insisting that Russia was the protector of the Orthodox Christians in the Ottoman Empire.",Who demanded protection for Roman Catholic rights in sacred places in Palestine?,"{'text': ['Charles de La Valette'], 'answer_start': [337]}"
263,5706300775f01819005e7a60,MP3,"An MP3 file is made up of MP3 frames, which consist of a header and a data block. This sequence of frames is called an elementary stream. Due to the ""byte reservoir"", frames are not independent items and cannot usually be extracted on arbitrary frame boundaries. The MP3 Data blocks contain the (compressed) audio information in terms of frequencies and amplitudes. The diagram shows that the MP3 Header consists of a sync word, which is used to identify the beginning of a valid frame. This is followed by a bit indicating that this is the MPEG standard and two bits that indicate that layer 3 is used; hence MPEG-1 Audio Layer 3 or MP3. After this, the values will differ, depending on the MP3 file. ISO/IEC 11172-3 defines the range of values for each section of the header along with the specification of the header. Most MP3 files today contain ID3 metadata, which precedes or follows the MP3 frames, as noted in the diagram.",A header and data block together make up what?,"{'text': ['MP3 frames'], 'answer_start': [26]}"
264,5acd438207355d001abf3b1b,Energy,"For example, consider electron–positron annihilation, in which the rest mass of individual particles is destroyed, but the inertia equivalent of the system of the two particles (its invariant mass) remains (since all energy is associated with mass), and this inertia and invariant mass is carried off by photons which individually are massless, but as a system retain their mass. This is a reversible process – the inverse process is called pair creation – in which the rest mass of particles is created from energy of two (or more) annihilating photons. In this system the matter (electrons and positrons) is destroyed and changed to non-matter energy (the photons). However, the total system mass and energy do not change during this interaction.",what is created and changed to non-matter energy?,"{'text': [], 'answer_start': []}"
265,5706983475f01819005e7c22,New_Delhi,"New Delhi has a population of 249,998. Hindi and Punjabi are the most widely spoken languages in New Delhi and the lingua franca of the city. English is primarily used as the formal language by business and government institutes. New Delhi has a literacy rate of 89.38% according to 2011 census, which is highest in Delhi.",What is the population of New Delhi?,"{'text': ['249,998'], 'answer_start': [30]}"
266,5a81fab831013a001a335039,Group_(mathematics),"Mathematicians often strive for a complete classification (or list) of a mathematical notion. In the context of finite groups, this aim leads to difficult mathematics. According to Lagrange's theorem, finite groups of order p, a prime number, are necessarily cyclic (abelian) groups Zp. Groups of order p2 can also be shown to be abelian, a statement which does not generalize to order p3, as the non-abelian group D4 of order 8 = 23 above shows. Computer algebra systems can be used to list small groups, but there is no classification of all finite groups.q[›] An intermediate step is the classification of finite simple groups.r[›] A nontrivial group is called simple if its only normal subgroups are the trivial group and the group itself.s[›] The Jordan–Hölder theorem exhibits finite simple groups as the building blocks for all finite groups. Listing all finite simple groups was a major achievement in contemporary group theory. 1998 Fields Medal winner Richard Borcherds succeeded in proving the monstrous moonshine conjectures, a surprising and deep relation between the largest finite simple sporadic group—the ""monster group""—and certain modular functions, a piece of classical complex analysis, and string theory, a theory supposed to unify the description of many physical phenomena.",When was the Jordan-Holder theorem published?,"{'text': [], 'answer_start': []}"
267,573402084776f419006616bd,"Punjab,_Pakistan","Despite the lack of a coastline, Punjab is the most industrialised province of Pakistan; its manufacturing industries produce textiles, sports goods, heavy machinery, electrical appliances, surgical instruments, vehicles, auto parts, metals, sugar mill plants, aircraft, cement, agricultural machinery, bicycles and rickshaws, floor coverings, and processed foods. In 2003, the province manufactured 90% of the paper and paper boards, 71% of the fertilizers, 69% of the sugar and 40% of the cement of Pakistan.",How much of Pakistan's sugar does Punjab manufacture?,"{'text': ['69%'], 'answer_start': [459]}"
268,5ad41292604f3c001a40024b,Affirmative_action_in_the_United_States,"This eventually led to LBJ's Civil Rights Act, which came shortly after President Kennedy's assassination. This document was more holistic than any President Kennedy had offered, and therefore more controversial. It aimed not only to integrate public facilities, but also private businesses that sold to the public, such as motels, restaurants, theaters, and gas stations. Public schools, hospitals, libraries, parks, among other things, were included in the bill as well. It also worked with JFK's executive order 11114 by prohibiting discrimination in the awarding of federal contracts and holding the authority of the government to deny contracts to businesses who discriminate. Maybe most significant of all, Title VII of the Civil Rights Act aimed to end discrimination in all firms with 25 or more employees. Another provision established the Equal Employment Opportunity Commission as the agency charged with ending discrimination in the nation's workplace.:74",Which other Executive Order did the Civil Right's Act not work closely with?,"{'text': [], 'answer_start': []}"
269,56df92d24a1a83140091eb5a,Hunter-gatherer,"Hunter-gatherers tend to have an egalitarian social ethos, although settled hunter-gatherers (for example, those inhabiting the Northwest Coast of North America) are an exception to this rule. Nearly all African hunter-gatherers are egalitarian, with women roughly as influential and powerful as men.", Where do people who are an exception to egalitarianism live?,"{'text': ['Northwest Coast of North America'], 'answer_start': [128]}"
270,57298de23f37b31900478489,Serbo-Croatian,"In the mid-19th century, Serbian (led by self-taught writer and folklorist Vuk Stefanović Karadžić) and most Croatian writers and linguists (represented by the Illyrian movement and led by Ljudevit Gaj and Đuro Daničić), proposed the use of the most widespread dialect, Shtokavian, as the base for their common standard language. Karadžić standardised the Serbian Cyrillic alphabet, and Gaj and Daničić standardized the Croatian Latin alphabet, on the basis of vernacular speech phonemes and the principle of phonological spelling. In 1850 Serbian and Croatian writers and linguists signed the Vienna Literary Agreement, declaring their intention to create a unified standard. Thus a complex bi-variant language appeared, which the Serbs officially called ""Serbo-Croatian"" or ""Serbian or Croatian"" and the Croats ""Croato-Serbian"", or ""Croatian or Serbian"". Yet, in practice, the variants of the conceived common literary language served as different literary variants, chiefly differing in lexical inventory and stylistic devices. The common phrase describing this situation was that Serbo-Croatian or ""Croatian or Serbian"" was a single language. During the Austro-Hungarian occupation of Bosnia and Herzegovina, the language of all three nations was called ""Bosnian"" until the death of administrator von Kállay in 1907, at which point the name was changed to ""Serbo-Croatian"".",What 1850 document formally declared the intent to create a unified standard?,"{'text': ['Vienna Literary Agreement'], 'answer_start': [594]}"
271,5acee37032bba1001ae4b89b,Neptune,"Neptune's more varied weather when compared to Uranus is due in part to its higher internal heating. Although Neptune lies over 50% further from the Sun than Uranus, and receives only 40% its amount of sunlight, the two planets' surface temperatures are roughly equal. The upper regions of Neptune's troposphere reach a low temperature of 51.8 K (−221.3 °C). At a depth where the atmospheric pressure equals 1 bar (100 kPa), the temperature is 72.00 K (−201.15 °C). Deeper inside the layers of gas, the temperature rises steadily. As with Uranus, the source of this heating is unknown, but the discrepancy is larger: Uranus only radiates 1.1 times as much energy as it receives from the Sun; whereas Neptune radiates about 2.61 times as much energy as it receives from the Sun. Neptune is the farthest planet from the Sun, yet its internal energy is sufficient to drive the fastest planetary winds seen in the Solar System. Depending on the thermal properties of its interior, the heat left over from Neptune's formation may be sufficient to explain its current heat flow, though it is more difficult to simultaneously explain Uranus's lack of internal heat while preserving the apparent similarity between the two planets.",Why might Uranus have more varied weather than Jupiter?,"{'text': [], 'answer_start': []}"
272,5a42a2bd4a4859001aac7265,Super_Nintendo_Entertainment_System,"Designed by Masayuki Uemura, the designer of the original Famicom, the Super Famicom was released in Japan on Wednesday, November 21, 1990 for ¥25,000 (US$210). It was an instant success; Nintendo's initial shipment of 300,000 units sold out within hours, and the resulting social disturbance led the Japanese government to ask video game manufacturers to schedule future console releases on weekends. The system's release also gained the attention of the Yakuza, leading to a decision to ship the devices at night to avoid robbery.",What event happened after the Yakuza noticed the sale of the original Famicom?,"{'text': [], 'answer_start': []}"
